{
  "$schema": "https://json-schema.org/draft/2020-12/schema",
  "$id": "https://github.com/Q00/ouroboros-plugins/schemas/plugin.schema.json",
  "title": "Ouroboros Plugin Manifest",
  "type": "object",
  "required": [
    "schema_version",
    "name",
    "version",
    "source",
    "commands",
    "capabilities",
    "permissions",
    "entrypoint"
  ],
  "additionalProperties": false,
  "properties": {
    "schema_version": {
      "type": "string",
      "const": "0.1"
    },
    "name": {
      "type": "string",
      "pattern": "^[a-z0-9][a-z0-9-]{1,62}[a-z0-9]$"
    },
    "version": {
      "type": "string",
      "pattern": "^[0-9]+\\.[0-9]+\\.[0-9]+$"
    },
    "description": {
      "type": "string",
      "default": ""
    },
    "source": {
      "type": "object",
      "required": ["type"],
      "additionalProperties": false,
      "properties": {
        "type": {
          "type": "string",
          "enum": ["local_path", "plugin_home", "first_party"]
        },
        "path": {
          "type": "string"
        },
        "repository": {
          "type": "string"
        }
      }
    },
    "commands": {
      "type": "array",
      "minItems": 1,
      "items": {
        "type": "object",
        "required": ["namespace", "name", "summary", "usage", "risk"],
        "additionalProperties": false,
        "properties": {
          "namespace": {
            "type": "string",
            "pattern": "^[a-z0-9][a-z0-9-]{1,62}[a-z0-9]$"
          },
          "name": {
            "type": "string",
            "pattern": "^[a-z0-9][a-z0-9-]{0,62}[a-z0-9]$"
          },
          "summary": {
            "type": "string",
            "minLength": 1
          },
          "usage": {
            "type": "string",
            "minLength": 1
          },
          "risk": {
            "type": "string",
            "enum": ["read_only", "write", "destructive"]
          },
          "requires_confirmation": {
            "type": "boolean",
            "default": false
          },
          "arguments": {
            "type": "array",
            "items": {
              "type": "object",
              "required": ["name", "type", "required"],
              "additionalProperties": false,
              "properties": {
                "name": {
                  "type": "string",
                  "pattern": "^[a-z][a-z0-9_-]*$"
                },
                "type": {
                  "type": "string",
                  "enum": ["string", "boolean", "integer", "path", "url"]
                },
                "required": {
                  "type": "boolean"
                },
                "description": {
                  "type": "string"
                }
              }
            }
          },
          "permissions": {
            "type": "array",
            "items": {
              "type": "string",
              "pattern": "^[a-z][a-z0-9_-]*(?::[a-z][a-z0-9_-]*){0,3}$"
            },
            "uniqueItems": true
          },
          "upstream": {
            "type": "object",
            "required": ["capability", "mode"],
            "additionalProperties": false,
            "properties": {
              "capability": {
                "type": "string",
                "minLength": 1
              },
              "mode": {
                "type": "string",
                "enum": [
                  "installed_tool",
                  "pinned_checkout",
                  "managed_install_deferred",
                  "none"
                ]
              },
              "tool": {
                "type": "string"
              },
              "repository": {
                "type": "string"
              },
              "notes": {
                "type": "string"
              }
            }
          },
          "artifacts": {
            "type": "object",
            "required": ["writes"],
            "additionalProperties": false,
            "properties": {
              "writes": {
                "type": "array",
                "minItems": 1,
                "items": {
                  "type": "string",
                  "pattern": "^[A-Za-z0-9._/-]+$"
                },
                "uniqueItems": true
              },
              "root_template": {
                "type": "string"
              },
              "bounded": {
                "type": "boolean",
                "default": true
              }
            }
          },
          "handoff": {
            "type": "object",
            "required": ["produces"],
            "additionalProperties": false,
            "properties": {
              "produces": {
                "type": "boolean"
              },
              "consumer": {
                "type": "string"
              },
              "description": {
                "type": "string"
              }
            }
          },
          "timeout_seconds": {
            "type": "integer",
            "minimum": 1,
            "maximum": 86400
          },
          "result_states": {
            "type": "array",
            "minItems": 1,
            "items": {
              "type": "string",
              "enum": ["completed", "blocked", "failed", "cancelled"]
            },
            "uniqueItems": true
          },
          "redaction": {
            "type": "object",
            "required": ["rules"],
            "additionalProperties": false,
            "properties": {
              "rules": {
                "type": "array",
                "minItems": 1,
                "items": {
                  "type": "string",
                  "minLength": 1
                },
                "uniqueItems": true
              }
            }
          }
        }
      }
    },
    "capabilities": {
      "type": "array",
      "items": {
        "type": "object",
        "required": ["name", "access"],
        "additionalProperties": false,
        "properties": {
          "name": {
            "type": "string",
            "enum": [
              "seed",
              "ledger",
              "state",
              "provenance",
              "runtime",
              "mcp",
              "handoff",
              "progress"
            ]
          },
          "access": {
            "type": "string",
            "enum": ["read", "write", "execute", "attach"]
          },
          "reason": {
            "type": "string"
          }
        }
      },
      "uniqueItems": true
    },
    "permissions": {
      "type": "array",
      "items": {
        "type": "object",
        "required": ["scope", "risk", "required"],
        "additionalProperties": false,
        "properties": {
          "scope": {
            "type": "string",
            "pattern": "^[a-z][a-z0-9_-]*(?::[a-z][a-z0-9_-]*){0,3}$"
          },
          "risk": {
            "type": "string",
            "enum": ["read_only", "write", "destructive"]
          },
          "required": {
            "type": "boolean"
          },
          "reason": {
            "type": "string"
          }
        }
      },
      "uniqueItems": true
    },
    "entrypoint": {
      "type": "object",
      "required": ["type", "command"],
      "additionalProperties": false,
      "properties": {
        "type": {
          "type": "string",
          "const": "command"
        },
        "command": {
          "type": "string",
          "minLength": 1
        }
      }
    },
    "audit": {
      "type": "object",
      "required": ["events"],
      "additionalProperties": false,
      "default": {
        "events": [
          "plugin.invoked",
          "plugin.permission_used",
          "plugin.completed",
          "plugin.failed"
        ]
      },
      "properties": {
        "events": {
          "type": "array",
          "minItems": 1,
          "items": {
            "type": "string",
            "enum": [
              "plugin.discovered",
              "plugin.installed",
              "plugin.trusted",
              "plugin.invoked",
              "plugin.permission_used",
              "plugin.completed",
              "plugin.failed"
            ]
          },
          "uniqueItems": true
        }
      }
    }
  }
}
